{
  "version": "1.0.0",
  "lastUpdated": "2026-09-04T18:30:00Z",
  "categories": [
    {
      "id": "structured-outputs",
      "name": "Structured Outputs & Schemas",
      "icon": "code",
      "description": "Deterministic JSON Schema enforcement, function calling constraints, and structured data validation."
    },
    {
      "id": "caching-efficiency",
      "name": "Prompt Caching & Cost Efficiency",
      "icon": "zap",
      "description": "Context caching mechanisms, write premiums, read discounts, and batch offline processing."
    },
    {
      "id": "multimodal",
      "name": "Multimodal Inputs & Processing",
      "icon": "layers",
      "description": "Native perception across audio speech, high-resolution video frames, charts, and PDF documents."
    },
    {
      "id": "reasoning-agents",
      "name": "Reasoning & Agentic Execution",
      "icon": "cpu",
      "description": "Chain-of-thought budgets, sandboxed code execution, web search grounding, and system prompts."
    },
    {
      "id": "limits-throughput",
      "name": "Context Limits & Throughput",
      "icon": "sliders",
      "description": "Context window depth, single-turn output token ceilings, and inference velocity."
    }
  ],
  "models": [
    {
      "id": "gpt-4o",
      "name": "GPT-4o",
      "provider": "openai",
      "providerName": "OpenAI",
      "contextWindow": "128k",
      "maxOutput": "16,384",
      "badge": "Omni Flagship",
      "pricing": {
        "input": "$2.50 / 1M",
        "output": "$10.00 / 1M",
        "cachedInput": "$1.25 / 1M (-50%)"
      }
    },
    {
      "id": "gpt-4o-mini",
      "name": "GPT-4o-mini",
      "provider": "openai",
      "providerName": "OpenAI",
      "contextWindow": "128k",
      "maxOutput": "16,384",
      "badge": "Fast & Cheap",
      "pricing": {
        "input": "$0.15 / 1M",
        "output": "$0.60 / 1M",
        "cachedInput": "$0.075 / 1M (-50%)"
      }
    },
    {
      "id": "o3-mini",
      "name": "o3-mini",
      "provider": "openai",
      "providerName": "OpenAI",
      "contextWindow": "200k",
      "maxOutput": "100,000",
      "badge": "STEM Reasoning",
      "pricing": {
        "input": "$1.10 / 1M",
        "output": "$4.40 / 1M",
        "cachedInput": "$0.55 / 1M (-50%)"
      }
    },
    {
      "id": "claude-3-5-sonnet",
      "name": "Claude 3.5 Sonnet",
      "provider": "anthropic",
      "providerName": "Anthropic",
      "contextWindow": "200k",
      "maxOutput": "8,192",
      "badge": "Code Benchmark Leader",
      "pricing": {
        "input": "$3.00 / 1M",
        "output": "$15.00 / 1M",
        "cachedInput": "$0.30 / 1M (-90%)"
      }
    },
    {
      "id": "claude-3-5-haiku",
      "name": "Claude 3.5 Haiku",
      "provider": "anthropic",
      "providerName": "Anthropic",
      "contextWindow": "200k",
      "maxOutput": "8,192",
      "badge": "Sub-Second Agent",
      "pricing": {
        "input": "$0.80 / 1M",
        "output": "$4.00 / 1M",
        "cachedInput": "$0.08 / 1M (-90%)"
      }
    },
    {
      "id": "gemini-2-0-flash",
      "name": "Gemini 2.0 Flash",
      "provider": "google",
      "providerName": "Google",
      "contextWindow": "1,048,576",
      "maxOutput": "8,192",
      "badge": "Realtime Multimodal",
      "pricing": {
        "input": "$0.10 / 1M",
        "output": "$0.40 / 1M",
        "cachedInput": "$0.025 / 1M (-75%)"
      }
    },
    {
      "id": "gemini-1-5-pro",
      "name": "Gemini 1.5 Pro",
      "provider": "google",
      "providerName": "Google",
      "contextWindow": "2,097,152",
      "maxOutput": "8,192",
      "badge": "2M Context King",
      "pricing": {
        "input": "$1.25 / 1M",
        "output": "$5.00 / 1M",
        "cachedInput": "$0.31 / 1M (-75%)"
      }
    },
    {
      "id": "deepseek-v3",
      "name": "DeepSeek-V3",
      "provider": "deepseek",
      "providerName": "DeepSeek",
      "contextWindow": "64k",
      "maxOutput": "8,192",
      "badge": "671B MoE Frontier",
      "pricing": {
        "input": "$0.14 / 1M",
        "output": "$0.28 / 1M",
        "cachedInput": "$0.014 / 1M (-90%)"
      }
    },
    {
      "id": "deepseek-r1",
      "name": "DeepSeek-R1",
      "provider": "deepseek",
      "providerName": "DeepSeek",
      "contextWindow": "64k",
      "maxOutput": "8,192",
      "badge": "Open Reasoning",
      "pricing": {
        "input": "$0.55 / 1M",
        "output": "$2.19 / 1M",
        "cachedInput": "$0.14 / 1M (-75%)"
      }
    },
    {
      "id": "llama-3-3-70b",
      "name": "Llama 3.3 70B (Groq)",
      "provider": "groq",
      "providerName": "Groq / Meta",
      "contextWindow": "128k",
      "maxOutput": "8,192",
      "badge": "Ultra LPUs (300+ T/s)",
      "pricing": {
        "input": "$0.59 / 1M",
        "output": "$0.79 / 1M",
        "cachedInput": "N/A"
      }
    }
  ],
  "features": [
    {
      "id": "strict-json-schema",
      "categoryId": "structured-outputs",
      "name": "Strict JSON Schema Enforcement",
      "summary": "Guarantees 100% adherence to a provided JSON schema using grammar-constrained sampling, eliminating malformed outputs.",
      "gotchas": [
        "OpenAI requires 'strict: true' inside response_format and all object fields must specify 'additionalProperties: false'.",
        "Anthropic lacks a native top-level strict mode; developers must use a forced tool choice ('tool_choice: { type: \"tool\", name: \"schema_name\" }').",
        "Gemini supports strict response_schema natively via 'response_mime_type: \"application/json\"' and 'response_schema'."
      ],
      "support": {
        "gpt-4o": {
          "status": "native",
          "label": "Native Strict",
          "sdkParam": "response_format: { type: 'json_schema', json_schema: { strict: true, schema: ... } }",
          "notes": "100% adherence. All object keys must be marked required.",
          "verified": true,
          "verifiedAt": "2026-09-04T18:00:00Z"
        },
        "gpt-4o-mini": {
          "status": "native",
          "label": "Native Strict",
          "sdkParam": "response_format: { type: 'json_schema', json_schema: { strict: true, schema: ... } }",
          "notes": "Fastest and cheapest strict schema validation.",
          "verified": true,
          "verifiedAt": "2026-09-04T18:00:00Z"
        },
        "o3-mini": {
          "status": "native",
          "label": "Native Strict",
          "sdkParam": "response_format: { type: 'json_schema', json_schema: { strict: true, schema: ... } }",
          "notes": "Generates internal reasoning first, then emits strictly validated JSON.",
          "verified": true,
          "verifiedAt": "2026-09-04T18:00:00Z"
        },
        "claude-3-5-sonnet": {
          "status": "partial",
          "label": "Tool Choice Hack",
          "sdkParam": "tool_choice: { type: 'tool', name: 'json_output' }, tools: [{ name: 'json_output', input_schema: ... }]",
          "notes": "No native response_format. Must define schema as a tool and force its invocation.",
          "verified": true,
          "verifiedAt": "2026-09-04T18:00:00Z"
        },
        "claude-3-5-haiku": {
          "status": "partial",
          "label": "Tool Choice Hack",
          "sdkParam": "tool_choice: { type: 'tool', name: 'json_output' }",
          "notes": "High schema fidelity, but consumes tool token overhead.",
          "verified": true,
          "verifiedAt": "2026-09-04T18:00:00Z"
        },
        "gemini-2-0-flash": {
          "status": "native",
          "label": "Native Schema",
          "sdkParam": "response_mime_type: 'application/json', response_schema: PydanticModel",
          "notes": "Native Pydantic or JSON schema validation at 120+ T/s.",
          "verified": true,
          "verifiedAt": "2026-09-04T18:00:00Z"
        },
        "gemini-1-5-pro": {
          "status": "native",
          "label": "Native Schema",
          "sdkParam": "response_mime_type: 'application/json', response_schema: PydanticModel",
          "notes": "Works across massive context windows (up to 2M tokens).",
          "verified": true,
          "verifiedAt": "2026-09-04T18:00:00Z"
        },
        "deepseek-v3": {
          "status": "partial",
          "label": "Standard JSON",
          "sdkParam": "response_format: { type: 'json_object' }",
          "notes": "Guarantees valid JSON syntax, but does not strictly validate keys against a schema.",
          "verified": true,
          "verifiedAt": "2026-09-04T18:00:00Z"
        },
        "deepseek-r1": {
          "status": "partial",
          "label": "Prompt Constrained",
          "sdkParam": "System prompt: 'Return ONLY JSON in ```json blocks'",
          "notes": "Thinking tokens precede the output; strict JSON mode is officially unsupported.",
          "verified": true,
          "verifiedAt": "2026-09-04T18:00:00Z"
        },
        "llama-3-3-70b": {
          "status": "native",
          "label": "Native Strict (Groq)",
          "sdkParam": "response_format: { type: 'json_object' } or guided_json",
          "notes": "Groq supports CFG/grammar constrained decoding natively.",
          "verified": true,
          "verifiedAt": "2026-09-04T18:00:00Z"
        }
      },
      "codeExamples": {
        "python": "# OpenAI Strict JSON Schema\nfrom pydantic import BaseModel\nfrom openai import OpenAI\n\nclient = OpenAI()\n\nclass CalendarEvent(BaseModel):\n    title: str\n    date: str\n    participants: list[str]\n\nresponse = client.beta.chat.completions.parse(\n    model=\"gpt-4o\",\n    messages=[{\"role\": \"user\", \"content\": \"Dinner with Alice tomorrow at 7pm\"}],\n    response_format=CalendarEvent,\n)\nevent = response.choices[0].message.parsed",